,tweet_id,timestamp,source,text,rating_numerator,rating_denominator,name,dogs_stage,retweet_count,favorite_count,jpg_url,img_num,confidence %,dog_breed
999,716802964044845056,2016-04-04 01:41:58,Twitter for iPhone,This is Link. He struggles with couches. 10/10 would assist https://t.co/SbX4e6Yg3o,10,10,link,,1317,4627,https://pbs.twimg.com/media/CfKYfeBXIAAopp2.jpg,2,61,malinois
1000,716791146589110272,2016-04-04 00:55:01,Twitter for iPhone,Meet Jennifur. She's supposed to be navigating. Not even buckled up. Insubordinate &amp; churlish. 11/10 would still pet https://t.co/h0trcJohYO,11,10,jennifur,,1474,5204,https://pbs.twimg.com/media/CfKNvU8WsAAvI9Z.jpg,1,46,pomeranian
1001,716439118184652801,2016-04-03 01:36:11,Twitter for iPhone,This is Bluebert. He just saw that both #FinalFur match ups are split 50/50. Amazed af. 11/10 https://t.co/Kky1DPG4iq,50,50,bluebert,,247,2574,https://pbs.twimg.com/media/CfFNk7cWAAA-hND.jpg,1,39,siberian_husky
1002,716285507865542656,2016-04-02 15:25:47,Twitter for iPhone,This is Stephanus. She stays woke. 12/10 https://t.co/WIWabMngQZ,12,10,stephanus,,1225,3041,https://pbs.twimg.com/media/CfDB3aJXEAAEZNv.jpg,1,43,yorkshire_terrier
1003,716080869887381504,2016-04-02 01:52:38,Twitter for iPhone,Here's a super majestic doggo and a sunset 11/10 https://t.co/UACnoyi8zu,11,10,unknown,doggo,1935,5272,https://pbs.twimg.com/media/CfAHv83UMAIEQYx.jpg,1,63,golden_retriever
1004,715928423106027520,2016-04-01 15:46:52,Twitter for iPhone,This is Bubbles. He's a Yorkshire Piccolope. 11/10 would snug aggressively https://t.co/3BhMojONxq,11,10,bubbles,,987,3485,https://pbs.twimg.com/media/Ce99GhLW8AAHG38.jpg,1,97,pug
1005,715733265223708672,2016-04-01 02:51:22,Twitter for iPhone,This is a taco. We only rate dogs. Please only send in dogs. Dogs are what we rate. Not tacos. Thank you... 10/10 https://t.co/cxl6xGY8B9,10,10,unknown,,1920,5093,https://pbs.twimg.com/media/Ce7LlUeUUAEQkQl.jpg,1,74,dandie_dinmont
1006,715696743237730304,2016-04-01 00:26:15,Twitter for iPhone,Meet Toby. He's a Lithuanian High-Steppin Stickeroo. One of the more accomplished Stickeroos around. 10/10 so nifty https://t.co/cYPHuJYTjC,10,10,toby,,1454,4257,https://pbs.twimg.com/media/Ce6qZC2WAAAcSoI.jpg,1,42,staffordshire_bullterrier
1007,715680795826982913,2016-03-31 23:22:53,Twitter for iPhone,This is Zeus. He's downright fabulous. 12/10 https://t.co/sSugyyRuTp,12,10,zeus,,1813,4719,https://pbs.twimg.com/media/Ce6b4MPWwAA22Xm.jpg,1,99,golden_retriever
1008,715360349751484417,2016-03-31 02:09:32,Twitter for iPhone,This is Bertson. He just wants to say hi. 11/10 would boop nose https://t.co/hwv7Wq6gDA,11,10,bertson,,1772,5955,https://pbs.twimg.com/media/Ce14cOvWwAAcFJH.jpg,1,,
1009,715342466308784130,2016-03-31 00:58:29,Twitter for iPhone,This is Oscar. He's a world renowned snowball inspector. It's a ruff job but someone has to do it. 10/10 great guy https://t.co/vSufMAKm3C,10,10,oscar,,768,3294,https://pbs.twimg.com/media/Ce1oLNqWAAE34w7.jpg,1,59,west_highland_white_terrier
1010,715220193576927233,2016-03-30 16:52:36,Twitter for iPhone,This is Nico. His selfie game is strong af. Excellent use of a sneaky tongue slip. 10/10 star material https://t.co/1OBdJkMOFx,10,10,nico,,736,2630,https://pbs.twimg.com/media/Cez49UqWsAIRQXc.jpg,1,58,chihuahua
1011,715200624753819648,2016-03-30 15:34:51,Twitter for iPhone,This is Michelangelope. He's half coffee cup. Rare af. 12/10 would hug until someone stopped me https://t.co/tvVDY0G911,12,10,michelangelope,,2110,5578,https://pbs.twimg.com/media/CeznK6IWEAEFUPq.jpg,1,95,chihuahua
1012,715009755312439296,2016-03-30 02:56:24,Twitter for iPhone,This is Siba. She's remarkably mobile. Very sleepy as well. 12/10 would happily transport https://t.co/TjnI33RE1i,12,10,siba,,1392,4550,https://pbs.twimg.com/media/Cew5kyOWsAA8Y_o.jpg,1,14,chihuahua
1013,714982300363173890,2016-03-30 01:07:18,Twitter for iPhone,This is Calbert. He forgot to clear his Google search history. 9/10 rookie mistake Calbert https://t.co/jRm5J3YCmj,9,10,calbert,,1166,4094,https://pbs.twimg.com/media/CewgnHAXEAAdbld.jpg,1,94,brittany_spaniel
1014,714957620017307648,2016-03-29 23:29:14,Twitter for iPhone,This is Curtis. He's an Albino Haberdasher. Terrified of dandelions. They really spook him up. 10/10 it'll be ok pup https://t.co/s8YcfZrWhK,10,10,curtis,,1595,4503,https://pbs.twimg.com/media/CewKKiOWwAIe3pR.jpg,1,25,great_pyrenees
1015,714631576617938945,2016-03-29 01:53:39,Twitter for iPhone,This is Benedict. He's a feisty pup. Needs a brushing. Portable af. Looks very angry actually. 4/10 might not pet https://t.co/3oeFfHjv0Z,4,10,benedict,,1122,3571,https://pbs.twimg.com/media/CerhoBWWAAA5eLL.jpg,1,,
1016,714606013974974464,2016-03-29 00:12:05,Twitter for iPhone,Here are two lil cuddly puppers. Both 12/10 would snug like so much https://t.co/zO4eb7C4tG,12,10,unknown,pupper,1038,3938,https://pbs.twimg.com/media/CerKYG8WAAM1aE-.jpg,1,29,norfolk_terrier
1017,714258258790387713,2016-03-28 01:10:13,Twitter for iPhone,"Meet Travis and Flurp. Travis is pretty chill but Flurp can't lie down properly. 10/10 &amp; 8/10
get it together Flurp https://t.co/Akzl5ynMmE",10,10,travis,,808,3281,https://pbs.twimg.com/media/CemOGNjWQAEoN7R.jpg,1,17,collie
1018,714251586676113411,2016-03-28 00:43:43,Twitter for iPhone,This is Thumas. He hates potted plants. 8/10 wtf Thumas https://t.co/rDVueNIcEi,8,10,thumas,,940,3570,https://pbs.twimg.com/media/CemIBt4WwAQqhVV.jpg,2,75,soft-coated_wheaten_terrier
1019,714214115368108032,2016-03-27 22:14:49,Twitter for iPhone,Happy Easter from the squad! ðŸ‡ðŸ¶ 13/10 for all https://t.co/YMx4KWJUAB,13,10,unknown,,990,2480,https://pbs.twimg.com/media/Cell8ikWIAACCJ-.jpg,1,53,pug
1020,714141408463036416,2016-03-27 17:25:54,Twitter for iPhone,"I know we only rate dogs, but since it's Easter I guess we could rate a bunny for a change. 10/10 petable as hell https://t.co/O2RlKXigHu",10,10,unknown,,1569,4673,https://pbs.twimg.com/media/Cekj0qwXEAAHcS6.jpg,1,58,labrador_retriever
1021,713919462244790272,2016-03-27 02:43:58,Twitter for iPhone,This is Kanu. He's a Freckled Ticonderoga. Simply flawless. 12/10 would perform an elaborate heist to capture https://t.co/7vyAzIURrE,12,10,kanu,,869,3564,https://pbs.twimg.com/media/CehZ9mLWsAAsn28.jpg,1,46,siberian_husky
1022,713900603437621249,2016-03-27 01:29:02,Twitter for iPhone,Happy Saturday here's 9 puppers on a bench. 99/90 good work everybody https://t.co/mpvaVxKmc1,99,90,unknown,pupper,829,3062,https://pbs.twimg.com/media/CehIzzZWQAEyHH5.jpg,1,37,golden_retriever
1023,713761197720473600,2016-03-26 16:15:05,Twitter for iPhone,This is Piper. She would really like that tennis ball core. Super sneaky tongue slip. 12/10 precious af https://t.co/QP6GHi5az9,12,10,piper,,1541,5308,https://pbs.twimg.com/media/CefKBOuWIAAIlKD.jpg,1,79,brittany_spaniel
1024,713411074226274305,2016-03-25 17:03:49,Twitter for iPhone,Here we see an extremely rare Bearded Floofmallow. Only a few left in the wild. 11/10 would pet with a purpose https://t.co/jVJJKlPbvq,11,10,unknown,,1440,4802,https://pbs.twimg.com/media/CeaLlAPUMAIcC7U.jpg,1,72,great_pyrenees
1025,713177543487135744,2016-03-25 01:35:51,Twitter for iPhone,This is Lance. Lance doesn't give a shit. 10/10 we should all be more like Lance https://t.co/SqnG9Ap28J,10,10,lance,,3183,7854,https://pbs.twimg.com/media/CeW3MWMWQAEOMbq.jpg,1,73,whippet
1026,713175907180089344,2016-03-25 01:29:21,Twitter for iPhone,Say hello to Opie and Clarkus. Clarkus fell asleep so Opie buried him. Ruthless af 10/10 for both https://t.co/xT7XaY4gnW,10,10,opie,,1630,4851,https://pbs.twimg.com/media/CeW1tERWAAAA9Q2.jpg,1,43,malamute
1027,712809025985978368,2016-03-24 01:11:29,Twitter for iPhone,This is Stubert. He just arrived. 10/10 https://t.co/HVGs5aAKAn,10,10,stubert,,7602,20378,https://pbs.twimg.com/media/CeRoBaxWEAABi0X.jpg,1,86,labrador_retriever
1028,712717840512598017,2016-03-23 19:09:09,Twitter for iPhone,Please don't send in any more polar bears. We only rate dogs. Thank you... 10/10 https://t.co/83RGhdIQz2,10,10,unknown,,5616,13474,https://pbs.twimg.com/media/CeQVF1eVIAAJaTv.jpg,1,73,great_pyrenees
1029,712668654853337088,2016-03-23 15:53:42,Twitter for iPhone,Say hello to Sunny and Roxy. They pull things out of water together. 10/10 for both https://t.co/88aedAmxcl,10,10,sunny,,1367,4531,https://pbs.twimg.com/media/CePoVTyWsAQEz1g.jpg,1,82,labrador_retriever
1030,712438159032893441,2016-03-23 00:37:48,Twitter for iPhone,This is Kane. He's a semi-submerged Haitian Huffleplop. Happy af. Sick waterfall. 11/10 would pat head approvingly https://t.co/7zjEC501Ul,11,10,kane,,1756,5799,https://pbs.twimg.com/media/CeMWubMWwAA6GwF.jpg,1,6,great_pyrenees
1031,712097430750289920,2016-03-22 02:03:52,Twitter for iPhone,I can't even comprehend how confused this dog must be right now. 10/10 https://t.co/8AGcQ4hIfK,10,10,unknown,,1172,4144,https://pbs.twimg.com/media/CeHg1klW8AE4YOB.jpg,1,72,labrador_retriever
1032,712092745624633345,2016-03-22 01:45:15,Twitter for iPhone,This is Steven. He's inverted af. Also very helpful. Scans anything you want for free. Takes him a while tho. 7/10 https://t.co/tA0ZiQ7JcG,7,10,steven,,1016,3211,https://pbs.twimg.com/media/CeHckpuW4AAF7rT.jpg,1,,
1033,712085617388212225,2016-03-22 01:16:55,Twitter for iPhone,"Say hello to Olive and Ruby. They are best buddies. Both 11/10 
1 like = 1 buddy https://t.co/yagmFdKlyL",11,10,olive,,556,3531,https://pbs.twimg.com/media/CeHWFksXIAAyypp.jpg,2,62,shih-tzu
1034,712065007010385924,2016-03-21 23:55:01,Twitter for iPhone,This is Chester. He's clearly in charge of the other dogs. Weird ass paws. Not fit for fetch. 6/10 would still pet https://t.co/o2GvskrhHt,6,10,chester,,700,2451,https://pbs.twimg.com/media/CeHDV73W0AM5Cf8.jpg,1,,
1035,711998809858043904,2016-03-21 19:31:59,Twitter for iPhone,RT @twitter: @dog_rates Awesome Tweet! 12/10. Would Retweet. #LoveTwitter https://t.co/j6FQGhxYuN,12,10,unknown,,138,0,https://pbs.twimg.com/tweet_video_thumb/CeGGkWuUUAAYWU1.jpg,1,5,kuvasz
1036,711968124745228288,2016-03-21 17:30:03,Twitter for iPhone,Meet Winston. He's trapped in a cup of coffee. Poor pupper. 10/10 someone free him https://t.co/2e6cUtKUuc,10,10,winston,pupper,2601,8776,https://pbs.twimg.com/media/CeFrO3qXEAADRbd.jpg,1,,
1037,711743778164514816,2016-03-21 02:38:34,Twitter for iPhone,Meet Roosevelt. He's calculating the best case scenario if he drops out instead of doing math hw. 11/10 relatable af https://t.co/QcSIRDpfVg,11,10,roosevelt,,1101,3095,https://pbs.twimg.com/media/CeCfMPDW0AAAEUj.jpg,1,45,lakeland_terrier
1038,711732680602345472,2016-03-21 01:54:29,Twitter for iPhone,I want to hear the joke this dog was just told. 10/10 https://t.co/1KiuZqqOD4,10,10,unknown,,4653,9756,https://pbs.twimg.com/media/CeCVGEbUYAASeY4.jpg,3,33,ibizan_hound
1039,711694788429553666,2016-03-20 23:23:54,Twitter for iPhone,Oh. My. God. 13/10 magical af https://t.co/Ezu6jQrKAZ,13,10,unknown,,20500,35865,https://pbs.twimg.com/tweet_video_thumb/CeBym7oXEAEWbEg.jpg,1,,
1040,711652651650457602,2016-03-20 20:36:28,Twitter for iPhone,This is Gary. He just wanted to say hi. 9/10 very personable pup https://t.co/Sk3CbhmKSW,9,10,gary,,1037,4228,https://pbs.twimg.com/media/CeBMT6-WIAA7Qqf.jpg,1,,
1041,711363825979756544,2016-03-20 01:28:47,Twitter for iPhone,"""Please, no puparazzi"" 11/10 https://t.co/nJIXSPfedK",11,10,unknown,,1287,3996,https://pbs.twimg.com/media/Cd9Fn5QUMAAYMT4.jpg,1,75,pembroke
1042,711306686208872448,2016-03-19 21:41:44,Twitter for iPhone,What hooligan sent in pictures w/out a dog in them? Churlish af. 3/10 just bc that's a neat fluffy bean bag chair https://t.co/wcwoGOkZvz,3,10,unknown,,819,3596,https://pbs.twimg.com/media/Cd8Rpl0W0AAN1kU.jpg,1,8,dandie_dinmont
1043,711008018775851008,2016-03-19 01:54:56,Twitter for iPhone,This is Chuckles. He had a balloon but he accidentally let go of it and it floated away. 11/10 hang in there pupper https://t.co/68iNM7B5gW,11,10,chuckles,pupper,710,3275,https://pbs.twimg.com/media/Cd4CBQFW8AAY3ND.jpg,1,73,french_bulldog
1044,710997087345876993,2016-03-19 01:11:29,Twitter for iPhone,Meet Milo and Amos. They are the best of pals. Both 12/10 would pet at the same time https://t.co/Mv37BHEyyD,12,10,milo,,1561,4960,https://pbs.twimg.com/media/Cd34FClUMAAnvGP.jpg,1,28,malamute
1045,710844581445812225,2016-03-18 15:05:29,Twitter for iPhone,This is Staniel. His selfie game is strong af. 10/10 I'd snapchat with Staniel https://t.co/UgkTw7TKyM,10,10,staniel,,779,2775,https://pbs.twimg.com/media/Cd1tYGmXIAAoW5b.jpg,1,20,pembroke
1046,710833117892898816,2016-03-18 14:19:56,Twitter for iPhone,Say hello to Sora. She's an Egyptian Pumpernickel. Mesmerizing af. 12/10 would bring home to mom https://t.co/PmTR4kxZkq,12,10,sora,,606,2937,https://pbs.twimg.com/media/Cd1i8qvUkAE-Jlr.jpg,1,80,pembroke
1047,710658690886586372,2016-03-18 02:46:49,Twitter for iPhone,Here's a brigade of puppers. All look very prepared for whatever happens next. 80/80 https://t.co/0eb7R1Om12,80,80,unknown,pupper,636,2529,https://pbs.twimg.com/media/CdzETn4W4AAVU5N.jpg,1,94,soft-coated_wheaten_terrier
1048,710588934686908417,2016-03-17 22:09:38,Twitter for iPhone,This is Beemo. He's a Chubberflop mix. 12/10 would cross the world for https://t.co/kzMVMU8HBV,12,10,beemo,,2107,4968,https://pbs.twimg.com/media/CdyE2x1W8AAe0TG.jpg,4,98,pembroke
1049,710283270106132480,2016-03-17 01:55:02,Twitter for iPhone,This is Gunner. He's a Figamus Newton. King of the peek-a-boo. Cool jeans. 11/10 https://t.co/ONuBILIYXZ,11,10,gunner,,580,2308,https://pbs.twimg.com/media/Cdtu3WRUkAAsRVx.jpg,2,93,shih-tzu
1050,710272297844797440,2016-03-17 01:11:26,Twitter for iPhone,We ðŸ‘ðŸ» only ðŸ‘ðŸ» rate ðŸ‘ðŸ» dogs. Pls stop sending in non-canines like this Dutch Panda Worm. This is infuriating. 11/10 https://t.co/odfLzBonG2,11,10,infuriating,,1425,4945,https://pbs.twimg.com/media/Cdtk414WoAIUG0v.jpg,1,58,old_english_sheepdog
1051,710269109699739648,2016-03-17 00:58:46,Twitter for iPhone,"The squad is back for St. Patrick's Day! â˜˜ ðŸ’š
13/10 for all https://t.co/OcCDb2bng5",13,10,unknown,,1257,2613,https://pbs.twimg.com/media/Cdth_KyWEAEXH3u.jpg,1,41,pug
1052,710153181850935296,2016-03-16 17:18:07,Twitter for iPhone,This is Lacy. She's tipping her hat to you. Daydreams of her life back on the frontier. 11/10 would pet so well https://t.co/fG5Pk3Et1I,11,10,lacy,,1006,3153,https://pbs.twimg.com/media/Cdr4jO2UAAAIo6W.jpg,2,0,cocker_spaniel
1053,710140971284037632,2016-03-16 16:29:35,Twitter for iPhone,This is Tater. His underbite is fierce af. Doesn't give a damn about your engagement photo. 8/10 https://t.co/nLuPY3pY12,8,10,tater,,1008,3017,https://pbs.twimg.com/media/Cdrtcr-W4AAqi5H.jpg,1,95,pekinese
1054,710117014656950272,2016-03-16 14:54:24,Twitter for iPhone,This pupper got her hair chalked for her birthday. Hasn't told her parents yet. Rebellious af. 11/10 very nifty https://t.co/h1OX2mLtxV,11,10,unknown,pupper,2233,5999,https://pbs.twimg.com/media/CdrXp9dWoAAcRfn.jpg,2,80,toy_poodle
1055,709918798883774466,2016-03-16 01:46:45,Twitter for iPhone,Meet Watson. He's a Suzuki Tickleboop. Leader of a notorious biker gang. Only one ear functional. 12/10 snuggable af https://t.co/R1gLc5vDqG,12,10,watson,,1215,3250,https://pbs.twimg.com/media/CdojYQmW8AApv4h.jpg,2,95,pembroke
1056,709901256215666688,2016-03-16 00:37:03,Twitter for iPhone,"WeRateDogs stickers are here and they're 12/10! Use code ""puppers"" at checkout ðŸ¶ðŸ¾

Shop now: https://t.co/k5xsufRKYm https://t.co/ShXk46V13r",12,10,unknown,pupper,112,732,https://pbs.twimg.com/media/CdoTbL_XIAAitq2.jpg,2,,
1057,709852847387627521,2016-03-15 21:24:41,Twitter for iPhone,*lets out a tiny whimper and then collapses* ...12/10 https://t.co/BNdVZEHRow,12,10,unknown,,1336,3824,https://pbs.twimg.com/media/CdnnZhhWAAEAoUc.jpg,2,94,chihuahua
1058,709566166965075968,2016-03-15 02:25:31,Twitter for iPhone,This is Olaf. He's gotta be rare. Seems sturdy. Tail is floofy af. 12/10 would do whatever it takes to pet https://t.co/E9jaU59bh9,12,10,olaf,,1367,3865,https://pbs.twimg.com/media/Cdjiqi6XIAIUOg-.jpg,1,99,chow
1059,709556954897764353,2016-03-15 01:48:55,Twitter for iPhone,This is Cecil. She's a Gigglefloof Poofer. Outdoorsy af. One with nature. 12/10 would strategically capture https://t.co/ijJB0DuOIC,12,10,cecil,,1204,3593,https://pbs.twimg.com/media/CdjaSFCWAAAJZh3.jpg,2,79,golden_retriever
1060,709519240576036864,2016-03-14 23:19:03,Twitter for iPhone,This is Vince. He's a Gregorian Flapjeck. White spot on legs almost looks like another dog (whoa). 9/10 rad as hell https://t.co/aczGAV2dK4,9,10,vince,,277,1620,https://pbs.twimg.com/media/Cdi3-f7W8AUOm9T.jpg,1,41,cocker_spaniel
1061,709449600415961088,2016-03-14 18:42:20,Twitter for iPhone,Meet Karma. She's just a head. Lost body during the Second Punic War (unfortunate). Loves to travel 10/10 petable af https://t.co/c6af6nYEPo,10,10,karma,,665,2420,https://pbs.twimg.com/media/Cdh4pgAW0AEKJ_a.jpg,2,78,maltese_dog
1062,709409458133323776,2016-03-14 16:02:49,Twitter for iPhone,This is Billy. He sensed a squirrel. 8/10 damn it Billy https://t.co/Yu0K98VZ9A,8,10,billy,,788,2855,https://pbs.twimg.com/media/CdhUIMSUIAA4wYK.jpg,1,79,shetland_sheepdog
1063,709225125749587968,2016-03-14 03:50:21,Twitter for iPhone,This is Walker. He's a Butternut Khalifa. Appears fuzzy af. 11/10 would hug for a ridiculous amount of time https://t.co/k6fEWHSALn,11,10,walker,,647,2615,https://pbs.twimg.com/media/Cdese-zWEAArIqE.jpg,1,27,labrador_retriever
1064,709207347839836162,2016-03-14 02:39:42,Twitter for iPhone,This is Penny. She's trying on her prom dress. Stunning af 11/10 https://t.co/qcZDZGCapg,11,10,penny,,6567,13755,https://pbs.twimg.com/media/CdecUSzUIAAHCvg.jpg,1,94,chihuahua
1065,709198395643068416,2016-03-14 02:04:08,Twitter for iPhone,"From left to right:
Cletus, Jerome, Alejandro, Burp, &amp; Titson
None know where camera is. 45/50 would hug all at once https://t.co/sedre1ivTK",45,50,unknown,,721,2634,https://pbs.twimg.com/media/CdeUKpcWoAAJAWJ.jpg,1,49,borzoi
1066,709158332880297985,2016-03-13 23:24:56,Twitter for iPhone,Meet Rodney. He's a Ukranian Boomchicka. Outside but would like to be inside. Only has one ear (unfortunate) 10/10 https://t.co/FjAj3ggXrR,10,10,rodney,,470,2236,https://pbs.twimg.com/media/CddvvSwWoAUObQw.jpg,1,21,siberian_husky
1067,709042156699303936,2016-03-13 15:43:18,Twitter for iPhone,This is Klevin. He's addicted to sandwiches (yes a hotdog is a sandwich fight me) It's tearing his family apart 9/10 https://t.co/7BkkVNu5pd,9,10,klevin,,1864,5197,https://pbs.twimg.com/media/CdcGBB3WwAAGBuU.jpg,1,6,rottweiler
1068,708845821941387268,2016-03-13 02:43:08,Twitter for iPhone,Here's a pupper with magic eyes. Not wearing a seat belt tho (irresponsible af). Very distracting to driver. 9/10 https://t.co/5DLJB4ssvI,9,10,unknown,pupper,1015,3226,https://pbs.twimg.com/media/CdZTgynWwAATZcx.jpg,1,74,schipperke
1069,708834316713893888,2016-03-13 01:57:25,Twitter for iPhone,Meet Malikai. He was rolling around having fun when he remembered the inevitable heat death of the universe. 10/10 https://t.co/Vd2FqHIIGn,10,10,malikai,,571,1860,https://pbs.twimg.com/media/CdZI_bpWEAAm1fs.jpg,1,28,eskimo_dog
1070,708810915978854401,2016-03-13 00:24:26,Twitter for iPhone,This is Mister. He's a wonderful father to his two pups. Heartwarming af. 10/10 for all https://t.co/2KcuJXL2r4,10,10,mister,,7848,18036,https://pbs.twimg.com/media/CdYzwuYUIAAHPkB.jpg,2,97,golden_retriever
1071,708738143638450176,2016-03-12 19:35:15,Twitter for iPhone,This is Coco. She gets to stay on the Bachelor for another week. Super pumped 11/10 https://t.co/wsCB6LFNxD,11,10,coco,,917,2997,https://pbs.twimg.com/media/CdXxlFPWwAABaOv.jpg,1,93,pomeranian
1072,708711088997666817,2016-03-12 17:47:45,Twitter for iPhone,This is Smokey. He really likes tennis balls. 11/10 https://t.co/Ah7WlYTUBQ,11,10,smokey,,834,2790,https://pbs.twimg.com/media/CdXY-GHWoAALing.jpg,2,5,german_short-haired_pointer
1073,708479650088034305,2016-03-12 02:28:06,Twitter for iPhone,Meet Bear. He's a Beneboop Cumberclap. Extremely unamused. 13/10 I'm in love with this picture https://t.co/uC8kUqAz0W,13,10,bear,,765,2768,https://pbs.twimg.com/media/CdUGcLMWAAI42q0.jpg,1,21,shih-tzu
1074,708469915515297792,2016-03-12 01:49:25,Twitter for iPhone,This is Bobble. He's a Croatian Galifianakis. Hears everything within 400 miles. 11/10 would snug diligently https://t.co/VwDc6PTDzk,11,10,bobble,,926,3357,https://pbs.twimg.com/media/CdT9n7mW0AQcpZU.jpg,1,74,chihuahua
1075,708356463048204288,2016-03-11 18:18:36,Twitter for iPhone,This is Oliver. That is his castle. He protects it with his life. He's also squishy af. 10/10 would squish softly https://t.co/oSuEGw0BhX,10,10,oliver,,1520,3929,https://pbs.twimg.com/media/CdSWcc1XIAAXc6H.jpg,2,87,pug
1076,708349470027751425,2016-03-11 17:50:48,Twitter for iPhone,This is River. He's changing the trumpet game. Innovative af. 11/10 such a good boy https://t.co/tK7a0AxQfd,11,10,river,,831,2568,https://pbs.twimg.com/media/CdSQFWOWAAApgfq.jpg,1,18,basenji
1077,708149363256774660,2016-03-11 04:35:39,Twitter for iPhone,This is Jebberson. He's the reigning hide and seek world champion. 10/10 hasn't lost his touch https://t.co/VEFkvWCoHF,10,10,jebberson,,1727,4672,https://pbs.twimg.com/media/CdPaEkHW8AA-Wom.jpg,1,35,cardigan
1078,708130923141795840,2016-03-11 03:22:23,Twitter for iPhone,Please stop sending in non canines like this Guatemalan Twiggle Bunny. We only rate dogs. Only send in dogs... 11/10 https://t.co/XKhobeGuvT,11,10,unknown,,943,3707,https://pbs.twimg.com/media/CdPJUWIWIAAIchl.jpg,1,71,french_bulldog
1079,708119489313951744,2016-03-11 02:36:57,Twitter for iPhone,This is Cooper. He basks in the glory of rebellion. 9/10 probably a preteen https://t.co/kDamUfeIpm,9,10,cooper,,1102,2937,https://pbs.twimg.com/media/CdO-6x5W8AENSBJ.jpg,1,26,norwich_terrier
1080,708109389455101952,2016-03-11 01:56:49,Twitter for iPhone,This is Remington. He was caught off guard by the magical floating cheese. Spooked af. 10/10 deep breaths pup https://t.co/mhPSADiJmZ,10,10,remington,,610,2124,https://pbs.twimg.com/media/CdO1u9vWAAApj2V.jpg,1,51,staffordshire_bullterrier
1081,708026248782585858,2016-03-10 20:26:26,Twitter for iPhone,Everybody stop what you're doing and watch this video. Frank is stuck in a loop. 13/10 (Vid by @klbmatty) https://t.co/5AJs8TIV1U,13,10,unknown,,2166,4799,https://pbs.twimg.com/ext_tw_video_thumb/708026062568087553/pu/img/rNhylAwIfb6YthGu.jpg,1,78,malinois
1082,707995814724026368,2016-03-10 18:25:30,Twitter for iPhone,This is Farfle. He lost his back legs during the Battle of Gettysburg. Goes 0-60 in 4.3 seconds (damn) 12/10 hero af https://t.co/NiQQWzIzzq,12,10,farfle,,1273,3385,https://pbs.twimg.com/media/CdNOb17WwAA5z4A.jpg,1,,
1083,707969809498152960,2016-03-10 16:42:10,Twitter for iPhone,Meet Rufus. He's a Honeysuckle Firefox. Curly af. Badass tie. About to go on his first date ever 11/10 good luck pup https://t.co/dGoTWNfIsm,11,10,rufus,,1097,2941,https://pbs.twimg.com/media/CdM2xRpXEAUsR4k.jpg,1,90,toy_poodle
1084,707776935007539200,2016-03-10 03:55:45,Twitter for iPhone,This is Sadie. She's a Bohemian Rhapsody. Remarkably portable. Could sneak on roller coasters with (probably). 11/10 https://t.co/DB8fyeDs8B,11,10,sadie,,1079,3593,https://pbs.twimg.com/media/CdKHWimWoAABs08.jpg,1,89,miniature_pinscher
1085,707741517457260545,2016-03-10 01:35:01,Twitter for iPhone,When your roommate eats your leftover Chili's but you pretend it's no big deal cuz you fat anyway. 10/10 head up pup https://t.co/0nMgoue8IR,10,10,unknown,,696,2718,https://pbs.twimg.com/media/CdJnJ1dUEAARNcf.jpg,1,73,whippet
1086,707693576495472641,2016-03-09 22:24:31,Twitter for iPhone,This is Jiminus. He's in a tub for some reason. What a jokester. Smh 7/10 churlish af https://t.co/84L4ED9Tpi,7,10,jiminus,,1133,3765,https://pbs.twimg.com/media/CdI7jDnW0AA2dtO.jpg,1,,
1087,707610948723478529,2016-03-09 16:56:11,Twitter for iPhone,This is Harper. She scraped her elbow attempting a backflip off a tree. Valiant effort tho. 12/10 https://t.co/oHKJHghrp5,12,10,harper,,7236,18557,https://pbs.twimg.com/media/CdHwZd0VIAA4792.jpg,1,38,golden_retriever
1088,707420581654872064,2016-03-09 04:19:44,Twitter for iPhone,This is Keurig. He's a rare dog. Laughs like an idiot tho. Head is basically a weapon. Poorly maintained goatee 4/10 https://t.co/xOrUyj7K30,4,10,keurig,,789,2499,https://pbs.twimg.com/media/CdFDQVgWIAArslx.jpg,1,14,kuvasz
1089,707411934438625280,2016-03-09 03:45:22,Twitter for iPhone,"""I shall trip the big pupper with leash. Big pupper will never see it coming. I am a genius."" Both 11/10 https://t.co/uQsCJ8pf51",11,10,unknown,pupper,673,2486,https://pbs.twimg.com/media/CdE7ZktXIAEiWLj.jpg,1,73,lakeland_terrier
1090,707387676719185920,2016-03-09 02:08:59,Twitter for iPhone,Meet Clarkus. He's a Skinny Eastern Worcestershire. Can tie own shoes (impressive af) 10/10 would put on track team https://t.co/XP5o7zGn0E,10,10,clarkus,,1490,3835,https://pbs.twimg.com/media/CdElVm7XEAADP6o.jpg,1,88,chihuahua
1091,707377100785885184,2016-03-09 01:26:57,Twitter for iPhone,This dog just brutally murdered a snowman. Currently toying with its nutritious remains 9/10 would totally still pet https://t.co/iKThgKnW1j,9,10,unknown,,1214,3603,https://pbs.twimg.com/media/CdEbt0NXIAQH3Aa.jpg,1,63,golden_retriever
1092,707315916783140866,2016-03-08 21:23:50,Twitter for iPhone,This is Finnegus. He's trapped in a snow globe. Poor pupper. 10/10 would make sure no one shook it https://t.co/BjpOa52jQ4,10,10,finnegus,pupper,727,2698,https://pbs.twimg.com/media/CdDkEkHWwAAAeUJ.jpg,2,97,bernese_mountain_dog
