,tweet_id,timestamp,source,text,rating_numerator,rating_denominator,name,dogs_stage,retweet_count,favorite_count,jpg_url,img_num,confidence %,dog_breed
530,791406955684368384,2016-10-26 22:31:36,Twitter for iPhone,Say hello to Levi. He's a Madagascan Butterbop. One of the more docile Butterbops I've seen. 12/10 would give all the pets https://t.co/Zcw9Sccctc,12,10,levi,,4797,14670,https://pbs.twimg.com/media/CvukbEkWAAAV-69.jpg,4,97,pembroke
531,791312159183634433,2016-10-26 16:14:55,Twitter for iPhone,This is Mabel. She's super h*ckin smol. Portable af. Comes with the smol shoe. 12/10 would keep in frocket https://t.co/GGJvxYt3xK,12,10,mabel,,2963,9841,https://pbs.twimg.com/media/CvtONV4WAAAQ3Rn.jpg,4,89,miniature_pinscher
532,791026214425268224,2016-10-25 21:18:40,Twitter for iPhone,RT @dog_rates: This is Alfie. He's touching a butt. Couldn't be happier. 11/10 https://t.co/gx3xF5mZbo,11,10,alfie,,4858,0,https://pbs.twimg.com/media/CpmyNumW8AAAJGj.jpg,1,37,malamute
533,790987426131050500,2016-10-25 18:44:32,Twitter for iPhone,This is Misty. She has a cowboy hat on her nose. 12/10 https://t.co/Eno0mypHIr,12,10,misty,,2483,11089,https://pbs.twimg.com/media/Cvom3ZJXEAE29TD.jpg,1,34,cocker_spaniel
534,790946055508652032,2016-10-25 16:00:09,Twitter for iPhone,This is Betty. She's assisting with the dishes. Such a good puppo. 12/10 h*ckin helpful af https://t.co/dgvTPZ9tgI,12,10,betty,puppo,5496,18601,https://pbs.twimg.com/media/CvoBPWRWgAA4het.jpg,1,24,golden_retriever
535,790723298204217344,2016-10-25 01:14:59,Twitter for iPhone,RT @dog_rates: This is Happy. He's a bathtub reviewer. Seems to be pleased with this one. 12/10 https://t.co/Ln89R4FP7v,12,10,happy,,2704,0,https://pbs.twimg.com/media/CvaYgDOWgAEfjls.jpg,1,7,golden_retriever
536,790698755171364864,2016-10-24 23:37:28,Twitter for iPhone,This is Mosby. He appears to be rather h*ckin snuggable af. 12/10 keep it up Mosby https://t.co/IiiBq460I7,12,10,mosby,,2203,9158,https://pbs.twimg.com/media/CvkgUjbUsAEvo7l.jpg,1,99,bernese_mountain_dog
537,790581949425475584,2016-10-24 15:53:19,Twitter for iPhone,This is Duke. He sneaks into the fridge sometimes. It's his safe place. 11/10 would give little jacket if necessary https://t.co/Fd5WFDTMH4,11,10,duke,,8183,22473,https://pbs.twimg.com/media/Cvi2FiKWgAAif1u.jpg,2,0,malinois
538,790337589677002753,2016-10-23 23:42:19,Twitter for iPhone,Meet Maggie. She can hear your cells divide. 12/10 can also probably fly https://t.co/ovE2hqXryV,12,10,maggie,,2167,8740,https://pbs.twimg.com/media/CvfX2AnWYAAQTay.jpg,1,65,pembroke
539,790277117346975746,2016-10-23 19:42:02,Twitter for iPhone,This is Bruce. He never backs down from a challenge. 11/10 you got this Bruce https://t.co/aI7umZHIq7,11,10,bruce,,3732,14081,https://pbs.twimg.com/media/Cveg1-NXgAASaaT.jpg,1,42,labrador_retriever
540,789986466051088384,2016-10-23 00:27:05,Twitter for iPhone,This is Happy. He's a bathtub reviewer. Seems to be pleased with this one. 12/10 https://t.co/Ln89R4FP7v,12,10,happy,,2704,10369,https://pbs.twimg.com/media/CvaYgDOWgAEfjls.jpg,1,7,golden_retriever
541,789628658055020548,2016-10-22 00:45:17,Twitter for iPhone,This is Eli. He can fly. 13/10 magical af https://t.co/huPSJJ7FDI,13,10,eli,,2080,8448,https://pbs.twimg.com/media/CvVTEnPXYAAWLyL.jpg,1,26,chow
542,789599242079838210,2016-10-21 22:48:24,Twitter for iPhone,This is Brownie. She's wearing a Halloween themed onesie. 12/10 festive af https://t.co/0R4meWXFOx,12,10,brownie,,2279,7620,https://pbs.twimg.com/media/CvU4UZpXgAE1pAV.jpg,2,87,chesapeake_bay_retriever
543,789530877013393408,2016-10-21 18:16:44,Twitter for iPhone,This is Rizzy. She smiles a lot. 12/10 contagious af https://t.co/TU4sZogVIq,12,10,rizzy,,3942,13188,https://pbs.twimg.com/media/CvT6IV6WEAQhhV5.jpg,3,36,schipperke
544,789268448748703744,2016-10-21 00:53:56,Twitter for iPhone,This is Stella. She's happier than I will ever be. 10/10 would trade lives with https://t.co/JSs2bfDtTS,10,10,stella,,3014,10196,https://pbs.twimg.com/media/CvQLdotWcAAZn86.jpg,1,81,malamute
545,789137962068021249,2016-10-20 16:15:26,Twitter for iPhone,This is Bo. He's a West Congolese Bugaboop Snuggle. Rather exotic. Master of the head tilt. 12/10 would pay to pet https://t.co/2jwxxtNzoN,12,10,bo,,3244,10875,https://pbs.twimg.com/media/CvOUw8vWYAAzJDq.jpg,2,74,chihuahua
546,788908386943430656,2016-10-20 01:03:11,Twitter for iPhone,"This is Lucy. She destroyed not one, but two remotes trying to turn off the debate. 11/10 relatable af https://t.co/3BXh073tDm",11,10,lucy,,14409,30653,https://pbs.twimg.com/media/CvLD-mbWYAAFI8w.jpg,1,3,golden_retriever
547,788765914992902144,2016-10-19 15:37:03,Twitter for iPhone,This is Butter. She can have whatever she wants forever. 12/10 would hug softly https://t.co/x5gXRS1abq,12,10,butter,,12014,30658,https://pbs.twimg.com/media/CvJCabcWgAIoUxW.jpg,1,50,cocker_spaniel
548,788412144018661376,2016-10-18 16:11:17,Twitter for iPhone,This is Dexter. He breaks hearts for a living. 11/10 h*ckin handsome af https://t.co/4DhSsC1W7S,11,10,dexter,,5990,16060,https://pbs.twimg.com/media/CvEAqQoWgAADj5K.jpg,1,80,golden_retriever
549,788178268662984705,2016-10-18 00:41:57,Twitter for iPhone,Atlas is back and this time he's got doggles. Still 13/10 solarly conscious af https://t.co/s7MgFWDySc,13,10,unknown,,2488,8100,https://pbs.twimg.com/media/CvAr88kW8AEKNAO.jpg,2,73,samoyed
550,788150585577050112,2016-10-17 22:51:57,Twitter for iPhone,This is Leo. He's a golden chow. Rather h*ckin rare. 13/10 would give extra pats https://t.co/xosHjFzVXc,13,10,leo,,1510,6865,https://pbs.twimg.com/media/CvASw6dWcAQmo3X.jpg,3,81,chow
551,788070120937619456,2016-10-17 17:32:13,Twitter for iPhone,RT @dog_rates: This is Bo and Ty. Bo eats paper and Ty felt left out. 11/10 for both https://t.co/1acHQS8rvK,11,10,bo,,3952,0,https://pbs.twimg.com/media/Co-hmcYXYAASkiG.jpg,1,73,golden_retriever
552,788039637453406209,2016-10-17 15:31:05,Twitter for iPhone,Did... did they pick out that license plate? 12/10 for both https://t.co/lRmUUOxgbQ,12,10,unknown,,1535,6867,https://pbs.twimg.com/media/Cu-t20yWEAAFHXi.jpg,1,,
553,787810552592695296,2016-10-17 00:20:47,Twitter for iPhone,This is Frank. He wears sunglasses and walks himself. 11/10 I'll never be this cool or independent https://t.co/pNNjBtHWPc,11,10,frank,,3540,9717,https://pbs.twimg.com/media/Cu7dg2RXYAIaGXE.jpg,2,36,pug
554,787717603741622272,2016-10-16 18:11:26,Twitter for iPhone,This is Tonks. She is a service puppo. Can hear a caterpillar hiccup from 7 miles away. 13/10 would follow anywhere https://t.co/i622ZbWkUp,13,10,tonks,puppo,3240,11416,https://pbs.twimg.com/media/Cu6I9vvWIAAZG0a.jpg,3,99,german_shepherd
555,787397959788929025,2016-10-15 21:01:17,Twitter for iPhone,This is Moose. He's rather h*ckin dangerous (you can tell by the collar). 11/10 would still attempt to snug https://t.co/lHVHGdDzb3,11,10,moose,,3300,12120,https://pbs.twimg.com/media/Cu1mQsDWEAAU_VQ.jpg,1,90,chihuahua
556,787322443945877504,2016-10-15 16:01:13,Twitter for iPhone,This is Lincoln. He forgot to use his blinker when he changed lanes just now. Guilty as h*ck. Still 10/10 https://t.co/lsrR83SiVp,10,10,lincoln,,2032,8726,https://pbs.twimg.com/media/Cu0hlfwWYAEdnXO.jpg,1,10,golden_retriever
557,786963064373534720,2016-10-14 16:13:10,Twitter for iPhone,This is Rory. He's got an interview in a few minutes. Looking spiffy af. Nervous as h*ck tho. 12/10 would hire https://t.co/ibj5g6xaAj,12,10,rory,,9327,29725,https://pbs.twimg.com/media/Cuvau3MW8AAxaRv.jpg,1,91,golden_retriever
558,786709082849828864,2016-10-13 23:23:56,Twitter for iPhone,"This is Logan, the Chow who lived. He solemnly swears he's up to lots of good. H*ckin magical af 9.75/10 https://t.co/yBO5wuqaPS",75,10,logan,,7069,20296,https://pbs.twimg.com/media/CurzvFTXgAA2_AP.jpg,1,46,pomeranian
559,786664955043049472,2016-10-13 20:28:35,Twitter for iPhone,"""Honestly Kathleen I just want more Ken Bone"" 12/10 https://t.co/HmlEvAMP4r",12,10,unknown,,2996,11957,https://pbs.twimg.com/media/CurLmoqXgAEPoJ-.jpg,1,51,leonberg
560,786595970293370880,2016-10-13 15:54:28,Twitter for iPhone,This is Dale. He's a real spookster. Did me quite the frighten. 11/10 not too spooky to pet tho https://t.co/L8BWDD4oBX,11,10,dale,,3601,10497,https://pbs.twimg.com/media/CuqM0fVWAAAboKR.jpg,1,70,pembroke
561,786363235746385920,2016-10-13 00:29:39,Twitter for iPhone,This is Rizzo. He has many talents. A true renaissance doggo. 13/10 entertaining af https://t.co/TVXpEJB7Wn,13,10,rizzo,doggo,4072,12189,https://pbs.twimg.com/media/Cum5LlfWAAAyPcS.jpg,1,92,golden_retriever
562,786233965241827333,2016-10-12 15:55:59,Twitter for iPhone,This is Mattie. She's extremely dangerous. Will bite your h*ckin finger right off. Still 11/10 would pet with caution https://t.co/78c9W8kLFh,11,10,mattie,,5571,17178,https://pbs.twimg.com/media/CulDnZpWcAAGbZ-.jpg,1,47,labrador_retriever
563,786036967502913536,2016-10-12 02:53:11,Twitter for iPhone,RT @dog_rates: This is Scout. He really wants to kiss himself. H*ckin inappropriate. 11/10 narcissistic af https://t.co/x0gV2Ck3AD,11,10,scout,,8237,0,https://pbs.twimg.com/media/CtKHLuCWYAA2TTs.jpg,1,99,golden_retriever
564,785927819176054784,2016-10-11 19:39:28,Twitter for iPhone,This is Lucy. She's strives to be the best potato she can be. 12/10 would boop https://t.co/lntsj7Fc4Y,12,10,lucy,,3652,12696,https://pbs.twimg.com/media/CugtKeXWEAAamDZ.jpg,1,0,toy_poodle
565,785872687017132033,2016-10-11 16:00:24,Twitter for iPhone,Meet Rusty. He appears to be rather h*ckin fluffy. Also downright adorable af. 12/10 would rub my face against his https://t.co/1j9kLGb4wV,12,10,rusty,,2130,7489,https://pbs.twimg.com/ext_tw_video_thumb/785872596088811520/pu/img/5O-_BgqdFQu_2Bt7.jpg,1,39,great_pyrenees
566,785639753186217984,2016-10-11 00:34:48,Twitter for iPhone,This is Pinot. He's a sophisticated doggo. You can tell by the hat. Also pointier than your average pupper. Still 10/10 would pet cautiously https://t.co/f2wmLZTPHd,10,10,pinot,doggo,2561,8735,https://pbs.twimg.com/media/CucnLmeWAAALOSC.jpg,1,,
567,785533386513321988,2016-10-10 17:32:08,Twitter for iPhone,This is Dallas. Her tongue is ridiculous. 11/10 h*ckin proud af https://t.co/h4jhlH4EyG,11,10,dallas,,2334,10183,https://pbs.twimg.com/media/CubGchjXEAA6gpw.jpg,2,43,miniature_pinscher
568,785264754247995392,2016-10-09 23:44:41,Twitter for iPhone,This is Doc. He requested to be carried around like that. 12/10 anything for Doc https://t.co/mWYACm4qnx,12,10,doc,,1911,8128,https://pbs.twimg.com/media/CuXSHNnWcAIWEwn.jpg,1,5,chow
569,785170936622350336,2016-10-09 17:31:53,Twitter for iPhone,This is Hero. He was enjoying the car ride until he remembered that bees are dying globally at an alarming rate. 11/10 https://t.co/cubFg7F4qQ,11,10,hero,,5639,13491,https://pbs.twimg.com/media/CuV8yfxXEAAUlye.jpg,2,2,eskimo_dog
570,784826020293709826,2016-10-08 18:41:19,Twitter for iPhone,This is Rusty. He's going D1 for sure. Insane vertical. 13/10 would draft https://t.co/AsykOwMrXQ,13,10,rusty,,3712,11310,https://pbs.twimg.com/media/CuRDF-XWcAIZSer.jpg,1,9,chow
571,784517518371221505,2016-10-07 22:15:26,Twitter for iPhone,This is Frankie. He has yet to learn how to control his tongue. 11/10 maybe one day https://t.co/p6fgYe2dB6,11,10,frankie,,2970,10039,https://pbs.twimg.com/media/CuMqhGrXYAQwRqU.jpg,2,75,malamute
572,784431430411685888,2016-10-07 16:33:21,Twitter for iPhone,This is Stormy. He's curly af. Already pupared for Coachella next year. 12/10 https://t.co/PHA1vtqqpt,12,10,stormy,,1491,6329,https://pbs.twimg.com/media/CuLcNkCXgAEIwK2.jpg,1,74,miniature_poodle
573,783839966405230592,2016-10-06 01:23:05,Twitter for iPhone,This is Riley. His owner put a donut pillow around him and he loves it so much he won't let anyone take it off. 13/10 https://t.co/8TCQcsZCZ8,13,10,riley,,12643,33689,https://pbs.twimg.com/media/CuDCSM-XEAAJw1W.jpg,1,,
574,783821107061198850,2016-10-06 00:08:09,Twitter for iPhone,This is Mairi. She has mastered the art of camouflage. 12/10 h*ckin sneaky af https://t.co/STcPjiNAHp,12,10,mairi,,2269,8209,https://pbs.twimg.com/media/CuCxIzyWEAQTnQA.jpg,1,26,lakeland_terrier
575,783695101801398276,2016-10-05 15:47:27,Twitter for iPhone,This is Loomis. He's the leader of the Kenneth search party. The passion is almost overwhelming. 12/10 one day he will be free https://t.co/kCRKlFg4AY,12,10,loomis,,3737,11650,https://pbs.twimg.com/media/CuA-iRHXYAAWP8e.jpg,3,31,chow
576,783466772167098368,2016-10-05 00:40:09,Twitter for iPhone,This is Finn. He likes eavesdropping from filing cabinets. It's a real issue but no one has approached him about it. 11/10 would still pet https://t.co/s8W8Del9HQ,11,10,finn,,2608,9468,https://pbs.twimg.com/media/Ct9u3ljW8AEnVIm.jpg,1,78,chihuahua
577,783391753726550016,2016-10-04 19:42:03,Twitter for iPhone,Meet Godi. He's an avid beachgoer and part time rainbow summoner. Eyeliner flawless af. 13/10 would snug well https://t.co/BO936YdJdi,13,10,godi,,6441,18908,https://pbs.twimg.com/media/Ct8qn8EWIAAk9zP.jpg,4,87,norwegian_elkhound
578,783347506784731136,2016-10-04 16:46:14,Twitter for iPhone,RT @dog_rates: This is Kenny. He just wants to be included in the happenings. 11/10 https://t.co/2S6oye3XqK,11,10,kenny,,6533,0,https://pbs.twimg.com/media/CVuQ2LeUsAAIe3s.jpg,1,61,cardigan
579,783334639985389568,2016-10-04 15:55:06,Twitter for iPhone,This is Dave. He's currently in a predicament. Doesn't seem to mind tho. 12/10 someone assist Dave https://t.co/nfprKAXqwu,12,10,dave,,13616,32651,https://pbs.twimg.com/media/Ct72q9jWcAAhlnw.jpg,2,59,cardigan
580,783085703974514689,2016-10-03 23:25:55,Twitter for iPhone,This is Earl. He can't catch. Did his best tho. 11/10 would repair confidence with extra pats https://t.co/IsqyvbjFgM,11,10,earl,,2565,9112,https://pbs.twimg.com/media/Ct4URfWUAAQ7lKe.jpg,1,24,chesapeake_bay_retriever
581,782969140009107456,2016-10-03 15:42:44,Twitter for iPhone,This is Cali. She arrived preassembled. Convenient af. 12/10 appears to be rather h*ckin pettable https://t.co/vOBV1ZqVcX,12,10,cali,,8521,26949,https://pbs.twimg.com/media/Ct2qO5PXEAE6eB0.jpg,1,17,golden_retriever
582,782747134529531904,2016-10-03 01:00:34,Twitter for iPhone,This is Deacon. He's the happiest almost dry doggo I've ever seen. 11/10 would smile back https://t.co/C6fUMnHt1H,11,10,deacon,doggo,1604,8310,https://pbs.twimg.com/media/CtzgXgeXYAA1Gxw.jpg,1,56,golden_retriever
583,782722598790725632,2016-10-02 23:23:04,Twitter for iPhone,"This is Penny. She fought a bee and the bee won. 10/10 you're fine Penny, everything's fine https://t.co/zrMVdfFej6",10,10,penny,,6238,19250,https://pbs.twimg.com/media/CtzKC7zXEAALfSo.jpg,1,57,irish_setter
584,782598640137187329,2016-10-02 15:10:30,Twitter for iPhone,This is Timmy. He's quite large. According to a trusted source it's actually a dog wearing a dog suit. 11/10 https://t.co/BIUchFwHqn,11,10,timmy,,2184,8694,https://pbs.twimg.com/media/CtxZTtxUMAEduGo.jpg,1,84,malamute
585,782305867769217024,2016-10-01 19:47:08,Twitter for iPhone,This is Sampson. He just graduated. Ready to be a doggo now. Time for the real world. 12/10 have fun with taxes https://t.co/pgVKxRw0s1,12,10,sampson,doggo,6470,18630,https://pbs.twimg.com/media/CttPBt0WIAAcsDE.jpg,1,50,briard
586,782021823840026624,2016-10-01 00:58:26,Twitter for iPhone,RT @dog_rates: This is Harper. She scraped her elbow attempting a backflip off a tree. Valiant effort tho. 12/10 https://t.co/oHKJHghrp5,12,10,harper,,7236,0,https://pbs.twimg.com/media/CdHwZd0VIAA4792.jpg,1,38,golden_retriever
587,781955203444699136,2016-09-30 20:33:43,Twitter for iPhone,This is Chipson. He weighed in at .3 ounces and is officially super h*ckin smol. Space-saving af. 11/10 would snug delicately https://t.co/FjEsk7A1JV,11,10,chipson,,3920,12357,https://pbs.twimg.com/media/CtoQGu4XgAQgv5m.jpg,1,,
588,781661882474196992,2016-09-30 01:08:10,Twitter for iPhone,Who keeps sending in pictures without dogs in them? This needs to stop. 5/10 for the mediocre road https://t.co/ELqelxWMrC,5,10,unknown,,3129,11634,https://pbs.twimg.com/media/CtkFS72WcAAiUrs.jpg,1,43,pembroke
589,781524693396357120,2016-09-29 16:03:01,Twitter for iPhone,Idk why this keeps happening. We only rate dogs. Not Bangladeshi Couch Chipmunks. Please only send dogs... 12/10 https://t.co/ya7bviQUUf,12,10,unknown,,6426,23163,https://pbs.twimg.com/media/CtiIj0AWcAEBDvw.jpg,1,0,chesapeake_bay_retriever
590,781251288990355457,2016-09-28 21:56:36,Twitter for iPhone,This is Oakley. He just got yelled at for going 46 in a 45. Churlish af. 11/10 would still pet so well https://t.co/xIYsa6LPA4,11,10,oakley,,2458,9428,https://pbs.twimg.com/media/CteP5H5WcAEhdLO.jpg,2,88,mexican_hairless
591,781163403222056960,2016-09-28 16:07:23,Twitter for iPhone,"We normally don't rate lobsters, but this one appears to be a really good lobster. 10/10 would pet with caution https://t.co/YkHc7U7uUy",10,10,unknown,,3168,10895,https://pbs.twimg.com/media/Ctc_-BTWEAAQpZh.jpg,1,97,shetland_sheepdog
592,780931614150983680,2016-09-28 00:46:20,Twitter for iPhone,I want to finally rate this iconic puppo who thinks the parade is all for him. 13/10 would absolutely attend https://t.co/5dUYOu4b8d,13,10,unknown,puppo,8536,24192,https://pbs.twimg.com/media/CtZtJxAXEAAyPGd.jpg,1,,
593,780858289093574656,2016-09-27 19:54:58,Twitter for iPhone,"This is Dash. He's very stylish, but also incredibly unimpressed with the current state of our nation. 10/10 would pet ears first https://t.co/YElO4hvXI6",10,10,dash,,2328,8033,https://pbs.twimg.com/media/CtYqeNHWgAATqYZ.jpg,1,48,chesapeake_bay_retriever
594,780800785462489090,2016-09-27 16:06:28,Twitter for iPhone,This is Koda. He has a weird relationship with tall grass. Slightly concerning. 11/10 would def still pet https://t.co/KQzSR8eCsw,11,10,koda,,1505,6141,https://pbs.twimg.com/media/CtX2Kr9XYAAuxrM.jpg,2,95,siberian_husky
595,780601303617732608,2016-09-27 02:53:48,Twitter for iPhone,Meet Hercules. He can have whatever he wants for the rest of eternity. 12/10 would snug passionately https://t.co/mH0IOyFdIG,12,10,hercules,,3839,13525,https://pbs.twimg.com/media/CtVAvX-WIAAcGTf.jpg,1,99,saint_bernard
596,780543529827336192,2016-09-26 23:04:13,Twitter for iPhone,Here's a perturbed super floof. 12/10 would snug so damn well https://t.co/VG095mi09Q,12,10,unknown,,2032,7040,https://pbs.twimg.com/media/CtUMLzRXgAAbZK5.jpg,1,62,golden_retriever
597,780496263422808064,2016-09-26 19:56:24,Twitter for iPhone,RT @dog_rates: This is Bell. She likes holding hands. 12/10 would definitely pet with other hand https://t.co/BXIuvkQO9b,12,10,bell,,4319,0,https://pbs.twimg.com/media/Ck2d7tJWUAEPTL3.jpg,1,99,pug
598,780476555013349377,2016-09-26 18:38:05,Twitter for iPhone,"RT @Patreon: Well. @dog_rates is on Patreon. 

12/10. 

https://t.co/rnKvzt6RJs https://t.co/v4e2ywe8iO",12,10,unknown,,136,0,https://pbs.twimg.com/tweet_video_thumb/CtTFZZfUsAE5hgp.jpg,1,91,pug
599,780459368902959104,2016-09-26 17:29:48,Twitter for iPhone,"This is Bear. Don't worry, he's not a real bear tho. Contains unreal amounts of squish. 11/10 heteroskedastic af https://t.co/coi4l1T2Sm",11,10,bear,,1224,5892,https://pbs.twimg.com/media/CtS_p9kXEAE2nh8.jpg,1,38,great_dane
600,780192070812196864,2016-09-25 23:47:39,Twitter for iPhone,We only rate dogs. Pls stop sending in non-canines like this Urban Floof Giraffe. I can't handle this. 11/10 https://t.co/zHIqpM5Gni,11,10,unknown,,2589,9712,https://pbs.twimg.com/media/CtPMhwvXYAIt6NG.jpg,1,14,vizsla
601,779834332596887552,2016-09-25 00:06:08,Twitter for iPhone,This is Scout. He really wants to kiss himself. H*ckin inappropriate. 11/10 narcissistic af https://t.co/x0gV2Ck3AD,11,10,scout,,8237,21252,https://pbs.twimg.com/media/CtKHLuCWYAA2TTs.jpg,1,99,golden_retriever
602,779377524342161408,2016-09-23 17:50:56,Twitter for iPhone,Have you ever seen such a smol pupper? Portable af. 12/10 would keep in shirt pocket https://t.co/KsqaIzlQ12,12,10,unknown,pupper,3613,9831,https://pbs.twimg.com/ext_tw_video_thumb/779377444025499652/pu/img/eIiLDy9F6rPNarEc.jpg,1,,
603,779123168116150273,2016-09-23 01:00:13,Twitter for iPhone,This is Reggie. He hugs everyone he meets. 12/10 keep spreading the love Reggie https://t.co/uMfhduaate,12,10,reggie,,4207,13206,https://pbs.twimg.com/media/CtAAYizW8AAWzBZ.jpg,1,43,toy_poodle
604,779056095788752897,2016-09-22 20:33:42,Twitter for iPhone,Everybody drop what you're doing and look at this dog. 13/10 must be super h*ckin rare https://t.co/I1bJUzUEW5,13,10,unknown,,5247,16500,https://pbs.twimg.com/media/Cs_DYr1XEAA54Pu.jpg,1,72,chihuahua
605,778990705243029504,2016-09-22 16:13:51,Twitter for iPhone,This is Jay. He's really h*ckin happy about the start of fall. Sneaky tongue slip in 2nd pic. 11/10 snuggly af https://t.co/vyx1X5eyWI,11,10,jay,,8437,22342,https://pbs.twimg.com/media/Cs-H5uhWcAAiNY9.jpg,2,71,cocker_spaniel
606,778748913645780993,2016-09-22 00:13:04,Twitter for iPhone,"This is Mya (pronounced ""mmmyah?""). Her head is round af. 11/10 would pat accordingly https://t.co/1dpEuALnY0",11,10,mya,,1562,7717,https://pbs.twimg.com/media/Cs6r_-kVIAALh1p.jpg,1,35,staffordshire_bullterrier
607,778650543019483137,2016-09-21 17:42:10,Twitter for iPhone,"Meet Strider. He thinks he's a sorority girl. Already wants to go to NYC for a weekend to say he's ""studied abroad"" 10/10 https://t.co/KYZkPuiC1l",10,10,strider,,1729,6430,https://pbs.twimg.com/media/Cs5ShihWEAAH2ti.jpg,1,51,german_shepherd
608,778624900596654080,2016-09-21 16:00:17,Twitter for iPhone,This is Penny. She's a sailor pup. 11/10 would take to the open seas with https://t.co/0rRxyBQt32,11,10,penny,,1176,5177,https://pbs.twimg.com/media/Cs47N3eWcAEmgiW.jpg,2,78,airedale
609,778408200802557953,2016-09-21 01:39:11,Twitter for iPhone,RIP Loki. Thank you for the good times. You will be missed by many. 14/10 https://t.co/gJKD9pst5A,14,10,unknown,,5023,15135,https://pbs.twimg.com/media/Cs12ICuWAAECNRy.jpg,3,84,pembroke
610,778396591732486144,2016-09-21 00:53:04,Twitter for iPhone,RT @dog_rates: This is an East African Chalupa Seal. We only rate dogs. Please only send in dogs. Thank you... 10/10 https://t.co/iHe6liLwWR,10,10,an,,14198,0,https://pbs.twimg.com/media/CcG07BYW0AErrC9.jpg,1,,
611,778383385161035776,2016-09-21 00:00:35,Twitter for iPhone,This is Nala. She's a future Dogue model. Won't respond to my texts. 13/10 would be an honor to pet https://t.co/zP1IvAATWv,13,10,nala,,1271,6515,https://pbs.twimg.com/media/Cs1fjyqWIAE2jop.jpg,1,34,collie
612,778286810187399168,2016-09-20 17:36:50,Twitter for iPhone,This is Stanley. He has too much skin. Isn't happy about it. Quite pupset actually. Still 11/10 would comfort https://t.co/hhTfnPrWfb,11,10,stanley,,3836,11576,https://pbs.twimg.com/media/Cs0HuUTWcAUpSE8.jpg,1,32,boston_bull
613,778039087836069888,2016-09-20 01:12:28,Twitter for iPhone,Evolution of a pupper yawn featuring Max. 12/10 groundbreaking stuff https://t.co/t8Y4x9DmVD,12,10,unknown,pupper,3065,9417,https://pbs.twimg.com/media/CswmaHmWAAAbdY9.jpg,2,71,german_shepherd
614,778027034220126208,2016-09-20 00:24:34,Twitter for iPhone,This is Sophie. She's a Jubilant Bush Pupper. Super h*ckin rare. Appears at random just to smile at the locals. 11.27/10 would smile back https://t.co/QFaUiIHxHq,27,10,sophie,pupper,1885,7320,https://pbs.twimg.com/media/Cswbc2yWcAAVsCJ.jpg,1,94,clumber
615,777885040357281792,2016-09-19 15:00:20,Twitter for iPhone,This is Wesley. He's clearly trespassing. Seems rather h*ckin violent too. Weaponized forehead. 3/10 wouldn't let in https://t.co/pL7wbMRW7M,3,10,wesley,,1893,7078,https://pbs.twimg.com/media/CsuaUH2WAAAWJh1.jpg,1,12,afghan_hound
616,777684233540206592,2016-09-19 01:42:24,Twitter for iPhone,"""Yep... just as I suspected. You're not flossing."" 12/10 and 11/10 for the pup not flossing https://t.co/SuXcI9B7pQ",12,10,unknown,,3403,12518,https://pbs.twimg.com/media/CsrjryzWgAAZY00.jpg,1,25,cocker_spaniel
617,777641927919427584,2016-09-18 22:54:18,Twitter for iPhone,RT @dog_rates: This is Arnie. He's a Nova Scotian Fridge Floof. Rare af. 12/10 https://t.co/lprdOylVpS,12,10,arnie,,4947,0,https://pbs.twimg.com/media/CmoPdmHW8AAi8BI.jpg,1,96,golden_retriever
618,777621514455814149,2016-09-18 21:33:11,Twitter for iPhone,This is Derek. You can't look at him and not smile. Must've just had a blue pupsicle. 12/10 would snug intensely https://t.co/BnVTMtUeI3,12,10,derek,,2910,9742,https://pbs.twimg.com/media/Csqqoo5WEAAMTVW.jpg,1,99,chow
619,777189768882946048,2016-09-17 16:57:35,Twitter for iPhone,This is Jeffrey. He's being held so he doesn't fly away. 12/10 would set free https://t.co/d3aLyCykn7,12,10,jeffrey,,4999,15921,https://pbs.twimg.com/media/Cskh9nRWYAAUxBP.jpg,2,98,chihuahua
620,776819012571455488,2016-09-16 16:24:19,Twitter for iPhone,RT @dog_rates: Everybody look at this beautiful pupper 13/10 https://t.co/hyAC5Hq9GC,13,10,unknown,pupper,15839,0,https://pbs.twimg.com/media/CW88XN4WsAAlo8r.jpg,3,34,chihuahua
621,776813020089548800,2016-09-16 16:00:31,Twitter for iPhone,Meet Solomon. He was arrested for possession of adorable and attempted extra pats on the head. 12/10 would post bail https://t.co/nFqLaOLUQA,12,10,solomon,,1405,5444,https://pbs.twimg.com/media/CsfLUDbXEAAu0VF.jpg,1,51,toy_poodle
622,776477788987613185,2016-09-15 17:48:25,Twitter for iPhone,This is Huck. He's addicted to caffeine. Hope it's not too latte to seek help. 11/10 stay strong pupper https://t.co/iJE3F0VozW,11,10,huck,pupper,3249,9858,https://pbs.twimg.com/media/CsaaaaxWgAEfzM7.jpg,1,88,labrador_retriever
623,776218204058357768,2016-09-15 00:36:55,Twitter for iPhone,Atlas rolled around in some chalk and now he's a magical rainbow floofer. 13/10 please never take a bath https://t.co/nzqTNw0744,13,10,unknown,floofer,18497,33345,https://pbs.twimg.com/media/CsWuVEdWcAAqbe9.jpg,1,94,samoyed
