,tweet_id,timestamp,source,text,rating_numerator,rating_denominator,name,dogs_stage,retweet_count,favorite_count,jpg_url,img_num,confidence %,dog_breed
1470,679828447187857408,2015-12-24 00:58:27,Twitter for iPhone,Everybody look at this beautiful pupper 13/10 https://t.co/hyAC5Hq9GC,13,10,unknown,pupper,15839,39726,https://pbs.twimg.com/media/CW88XN4WsAAlo8r.jpg,3,34,chihuahua
1471,679777920601223168,2015-12-23 21:37:40,Twitter for iPhone,This is Rinna. She's melting. 10/10 get inside pupper https://t.co/PA0czwucsb,10,10,rinna,pupper,1281,3390,https://pbs.twimg.com/media/CW8OYajUMAAPRoF.jpg,1,52,bloodhound
1472,679736210798047232,2015-12-23 18:51:56,Twitter for iPhone,This pup's name is Sabertooth (parents must be cool). Ears for days. Jumps unannounced. 9/10 would pet diligently https://t.co/iazoiNUviP,9,10,unknown,,918,2311,https://pbs.twimg.com/media/CW7oelWWcAAhyzz.jpg,1,31,french_bulldog
1473,679729593985699840,2015-12-23 18:25:38,Twitter for iPhone,This is Hunter. He was playing with his ball minding his own business. Has no idea what happened to the carpet. 8/10 https://t.co/DbUTDI3u1R,8,10,hunter,,937,2367,https://pbs.twimg.com/media/CW7iddWUsAElUC0.jpg,1,9,west_highland_white_terrier
1474,679722016581222400,2015-12-23 17:55:32,Twitter for iPhone,This is Mike. He is a Jordanian Frito Pilates. Frowning because he can't see directly in front of him. 8/10 https://t.co/NL5QJwdEpF,8,10,mike,,539,1817,https://pbs.twimg.com/media/CW7bkW6WQAAksgB.jpg,1,45,boxer
1475,679530280114372609,2015-12-23 05:13:38,Twitter for iPhone,Guys this really needs to stop. We've been over this way too many times. This is a giraffe. We only rate dogs.. 7/10 https://t.co/yavgkHYPOC,7,10,unknown,,2347,5208,https://pbs.twimg.com/media/CW4tL1vWcAIw1dw.jpg,1,75,dalmatian
1476,679527802031484928,2015-12-23 05:03:47,Twitter for iPhone,This little pupper just arrived. 11/10 would snug https://t.co/DA5aqnSGfB,11,10,unknown,pupper,823,2892,https://pbs.twimg.com/media/CW4q7jDWkAA2y8g.jpg,1,,
1477,679511351870550016,2015-12-23 03:58:25,Twitter for iPhone,Say hello to William. He makes fun of others because he's terrified of his own deep-seated insecurities. 7/10 https://t.co/bwuV6FlRxr,7,10,william,,1461,3711,https://pbs.twimg.com/media/CW4b-GUWYAAa8QO.jpg,1,76,chihuahua
1478,679503373272485890,2015-12-23 03:26:43,Twitter for iPhone,This is Dwight. He's a pointy pupper. Very docile. Attracts marshmallows. Hurts to pet but definitely worth it 8/10 https://t.co/jjW7zTxY9Z,8,10,dwight,pupper,1673,3484,https://pbs.twimg.com/media/CW4UtmYWsAAEjqA.jpg,1,,
1479,679475951516934144,2015-12-23 01:37:45,Twitter for iPhone,This is Evy. She doesn't want to be a Koala. 9/10 https://t.co/VITeF0Kl9L,9,10,evy,,728,2304,https://pbs.twimg.com/media/CW37xZbUoAAUXe5.jpg,1,14,maltese_dog
1480,679462823135686656,2015-12-23 00:45:35,Twitter for iPhone,Meet Hurley. He's the curly one. He hugs every other dog he sees during his walk. 11/10 for spreading the love https://t.co/M6vqkt2GKV,11,10,hurley,,21324,34856,https://pbs.twimg.com/media/CW3v1KxW8AAIOuy.jpg,1,62,toy_poodle
1481,679158373988876288,2015-12-22 04:35:49,Twitter for iPhone,This is Rubio. He has too much skin. 11/10 https://t.co/NLOHmlENag,11,10,rubio,,9193,23568,https://pbs.twimg.com/media/CWza7kpWcAAdYLc.jpg,1,27,pug
1482,679148763231985668,2015-12-22 03:57:37,Twitter for iPhone,I know everyone's excited for Christmas but that doesn't mean you can send in reindeer. We only rate dogs... 8/10 https://t.co/eWjWgbOCYL,8,10,unknown,,1163,3028,https://pbs.twimg.com/media/CWzSMmAWsAAyB1u.jpg,1,30,italian_greyhound
1483,679132435750195208,2015-12-22 02:52:45,Twitter for iPhone,This is Louis. He's a river dancer. His friends think it's badass. All are very supportive. 10/10 for Louis https://t.co/qoIvjKMY58,10,10,louis,,1314,3253,https://pbs.twimg.com/media/CWzDWOkXAAAP0k7.jpg,1,19,scottish_deerhound
1484,679111216690831360,2015-12-22 01:28:25,Twitter for iPhone,This is officially the greatest yawn of all time. 12/10 https://t.co/4R0Cc0sLVE,12,10,officially,,2893,6514,https://pbs.twimg.com/ext_tw_video_thumb/679111114081370114/pu/img/hFca8BHjRopgD0cM.jpg,1,18,kelpie
1485,679062614270468097,2015-12-21 22:15:18,Twitter for iPhone,This is Chompsky. He lives up to his name. 11/10 https://t.co/Xl37lQEWd0,11,10,chompsky,,9299,18712,https://pbs.twimg.com/media/CWyD2HGUYAQ1Xa7.jpg,2,4,schipperke
1486,679047485189439488,2015-12-21 21:15:11,Twitter for iPhone,This dog doesn't know how to stairs. Quite tragic really. 9/10 get it together pup https://t.co/kTpr9PTMg1,9,10,unknown,,781,2460,https://pbs.twimg.com/media/CWx2FaLWcAEQ3vh.jpg,1,0,golden_retriever
1487,678991772295516161,2015-12-21 17:33:48,Twitter for iPhone,If your Monday isn't going so well just take a look at this. Both 12/10 https://t.co/GJT6SILPGU,12,10,unknown,,1333,2537,https://pbs.twimg.com/media/CWxDaXHWsAAWV8W.jpg,1,33,eskimo_dog
1488,678969228704284672,2015-12-21 16:04:13,Twitter for iPhone,Meet Lola. She's a Metamorphic Chartreuse. Plays with her food. Insubordinate and churlish. Exquisite hardwood 11/10 https://t.co/etpBNXwN7f,11,10,lola,,528,1796,https://pbs.twimg.com/media/CWwu6OLUkAEo3gq.jpg,1,68,labrador_retriever
1489,678800283649069056,2015-12-21 04:52:53,Twitter for iPhone,Here's a pupper with some mean tan lines. Snazzy sweater though 12/10 https://t.co/DpCSVsl6vu,12,10,unknown,pupper,1018,2810,https://pbs.twimg.com/media/CWuVQSLW4AAI3w9.jpg,1,21,labrador_retriever
1490,678798276842360832,2015-12-21 04:44:55,Twitter for iPhone,This is Linda. She fucking hates trees. 7/10 https://t.co/blaY85FIxR,7,10,linda,,1350,3804,https://pbs.twimg.com/media/CWuTbAKUsAAvZHh.jpg,1,58,airedale
1491,678774928607469569,2015-12-21 03:12:08,Twitter for iPhone,This is Tug. He's not required to wear the cone he just wants his voice to project more clearly. 11/10 https://t.co/Sp739Ou2qx,11,10,tug,,1043,3037,https://pbs.twimg.com/media/CWt-MNIWEAAUC9S.jpg,1,19,pembroke
1492,678767140346941444,2015-12-21 02:41:11,Twitter for iPhone,This is Mia. She makes awful decisions. 8/10 https://t.co/G6TQVgTcZz,8,10,mia,,1553,3864,https://pbs.twimg.com/media/CWt3G6EVEAIGEPr.jpg,1,,
1493,678764513869611008,2015-12-21 02:30:45,Twitter for iPhone,"Meet Wilson. He got caught humping the futon. He's like ""dude, help me out here"" 10/10 I'd help Wilson out https://t.co/m6XoclB0qv",10,10,wilson,,544,1788,https://pbs.twimg.com/media/CWt0ubZWcAAkFER.jpg,1,69,irish_terrier
1494,678755239630127104,2015-12-21 01:53:54,Twitter for iPhone,This is Dash. He didn't think the water would be that cold. Damn it Dash it's December. Think a little. 10/10 https://t.co/NqcOwG8pxW,10,10,dash,,3741,7802,https://pbs.twimg.com/media/CWtsSQAUkAAnWws.jpg,1,60,malamute
1495,678740035362037760,2015-12-21 00:53:29,Twitter for iPhone,Meet Tango. He's a large dog. Doesn't care much for personal space. Owner isn't very accepting. Tongue slip. 6/10 https://t.co/p2T5kGebxe,6,10,tango,,1926,4099,https://pbs.twimg.com/media/CWtede2WIAAF_AJ.jpg,1,2,beagle
1496,678675843183484930,2015-12-20 20:38:24,Twitter for iPhone,Exotic pup here. Tail long af. Throat looks swollen. Might breathe fire. Exceptionally unfluffy 2/10 would still pet https://t.co/a8SqCaSo2r,2,10,unknown,,1680,3155,https://pbs.twimg.com/media/CWskEqnWUAAQZW_.jpg,1,,
1497,678643457146150913,2015-12-20 18:29:43,Twitter for iPhone,Meet Grizz. He just arrived. Couldn't wait until Christmas. Worried bc he saw the swastikas on the carpet. 10/10 https://t.co/QBGwYrT7rv,10,10,grizz,,489,2250,https://pbs.twimg.com/media/CWsGnyMVEAAM1Y1.jpg,1,33,labrador_retriever
1498,678446151570427904,2015-12-20 05:25:42,Twitter for iPhone,Touching scene here. Really stirs up the emotions. The bond between father &amp; son. So beautiful. 10/10 for both pups https://t.co/AJWJHov5gx,10,10,unknown,,1785,4358,https://pbs.twimg.com/media/CWpTLOYWsAEDhcU.jpg,1,28,staffordshire_bullterrier
1499,678424312106393600,2015-12-20 03:58:55,Twitter for iPhone,This is Crystal. She's a shitty fireman. No sense of urgency. People could be dying Crystal. 2/10 just irresponsible https://t.co/rtMtjSl9pz,2,10,crystal,,2880,5916,https://pbs.twimg.com/media/CWo_T8gW4AAgJNo.jpg,1,75,maltese_dog
1500,678410210315247616,2015-12-20 03:02:53,Twitter for iPhone,Say hello to Jerome. He can shoot french fries out of his mouth at insane speeds. Deadly af. 10/10 https://t.co/dIy88HwrX8,10,10,jerome,,2072,4640,https://pbs.twimg.com/media/CWoyfMiWUAAmGdd.jpg,1,14,schipperke
1501,678399652199309312,2015-12-20 02:20:55,Twitter for iPhone,This made my day. 12/10 please enjoy https://t.co/VRTbo3aAcm,12,10,unknown,,30742,61794,https://pbs.twimg.com/ext_tw_video_thumb/678399528077250560/pu/img/BOjUNHRsYLeSo0hl.jpg,1,1,bedlington_terrier
1502,678396796259975168,2015-12-20 02:09:34,Twitter for iPhone,These little fellas have opposite facial expressions. Both 12/10 https://t.co/LmThv0GWen,12,10,unknown,,478,1731,https://pbs.twimg.com/media/CWomSU_XIAAUYiK.jpg,2,95,pembroke
1503,678389028614488064,2015-12-20 01:38:42,Twitter for iPhone,"This is Bella. She just learned that her final grade in chem was a 92.49 
poor pupper 11/10 https://t.co/auOoKuoveM",11,10,bella,pupper,473,2044,https://pbs.twimg.com/media/CWofOHUWUAACGVa.jpg,1,51,miniature_pinscher
1504,678380236862578688,2015-12-20 01:03:46,Twitter for iPhone,This is Crumpet. He underestimated the snow. Quickly retreating. 10/10 https://t.co/a0Zx5LDFZa,10,10,crumpet,,1020,2655,https://pbs.twimg.com/media/CWoXOfSUAAA4u8g.jpg,1,4,samoyed
1505,678341075375947776,2015-12-19 22:28:09,Twitter for iPhone,This pupper likes tape. 12/10 https://t.co/cSp6w5GWgm,12,10,unknown,pupper,612,1896,https://pbs.twimg.com/media/CWnznDTU4AAa-6P.jpg,1,85,golden_retriever
1506,678334497360859136,2015-12-19 22:02:01,Twitter for iPhone,This is Rosie. She has a snazzy bow tie and a fin for a tail. Probably super fast underwater. Cool socks 10/10 https://t.co/GO76MdGBs0,10,10,rosie,,304,1427,https://pbs.twimg.com/media/CWntoDVWcAEl3NB.jpg,1,37,norfolk_terrier
1507,678278586130948096,2015-12-19 18:19:51,Twitter for iPhone,Another spooky pupper here. Most definitely floating. No legs. Probably knows some dark magic. 10/10 very spooked https://t.co/JK8MByRzgj,10,10,unknown,pupper,6857,12531,https://pbs.twimg.com/media/CWm6xySUEAAqfFU.jpg,1,89,maltese_dog
1508,678255464182861824,2015-12-19 16:47:58,Twitter for iPhone,This is Jessifer. She is a Bismoth Teriyaki. Flowers being attacked by hurricanes on bandana (rad). 9/10 stellar pup https://t.co/nZhmRwZzWv,9,10,jessifer,,418,1726,https://pbs.twimg.com/media/CWmlvxJU4AEAqaN.jpg,1,61,chihuahua
1509,678021115718029313,2015-12-19 01:16:45,Twitter for iPhone,This is Reese. He likes holding hands. 12/10 https://t.co/cbLroGCbmh,12,10,reese,,7148,15018,https://pbs.twimg.com/media/CWjQm5gXAAA9GkD.jpg,1,82,miniature_pinscher
1510,677918531514703872,2015-12-18 18:29:07,Twitter for iPhone,"""Everything looks pretty good in there. Make sure to brush your gums. Been flossing? How's school going?"" Both 10/10 https://t.co/lWL2IMJqLR",10,10,unknown,,463,1476,https://pbs.twimg.com/media/CWhzTbzWUAAEAUN.jpg,1,19,eskimo_dog
1511,677895101218201600,2015-12-18 16:56:01,Twitter for iPhone,Guys this was terrifying. Really spooked me up. We don't rate ghosts. We rate dogs. Please only send dogs... 9/10 https://t.co/EJImi1udYb,9,10,unknown,,2384,5275,https://pbs.twimg.com/media/CWhd_7WWsAAaqWG.jpg,1,55,dalmatian
1512,677716515794329600,2015-12-18 05:06:23,Twitter for iPhone,IT'S PUPPERGEDDON. Total of 144/120 ...I think https://t.co/ZanVtAtvIq,144,120,unknown,,1104,3323,https://pbs.twimg.com/media/CWe7kw9W4AE8UJh.jpg,1,2,chow
1513,677700003327029250,2015-12-18 04:00:46,Twitter for iPhone,This is Ralph. He's an interpretive dancer. 10/10 https://t.co/zoDdPyPFsa,10,10,ralph,,1622,3689,https://pbs.twimg.com/media/CWesj06W4AAIKl8.jpg,1,12,siberian_husky
1514,677698403548192770,2015-12-18 03:54:25,Twitter for iPhone,This is Sadie. She got her holidays confused. 9/10 damn it Sadie https://t.co/fm7HxOsuPK,9,10,sadie,,363,1332,https://pbs.twimg.com/media/CWerGmOXAAAm6NY.jpg,1,91,shih-tzu
1515,677687604918272002,2015-12-18 03:11:30,Twitter for iPhone,This was Cindy's face when she heard Susan forgot the snacks for after the kid's soccer game. 11/10 https://t.co/gzkuVGRgAD,11,10,unknown,,950,2681,https://pbs.twimg.com/media/CWehRdEWIAAySyO.jpg,1,57,pembroke
1516,677673981332312066,2015-12-18 02:17:22,Twitter for iPhone,Endangered triangular pup here. Could be a wizard. Caught mid-laugh. No legs. Just fluff. Probably a wizard. 9/10 https://t.co/GFVIHIod0Z,9,10,unknown,,1677,3603,https://pbs.twimg.com/media/CWeU5LBWEAA8F0J.jpg,1,81,maltese_dog
1517,677662372920729601,2015-12-18 01:31:14,Twitter for iPhone,"In honor of the new Star Wars movie. Here's Yoda pug. 12/10 pet really well, would I https://t.co/pvjdRn00XH",12,10,unknown,,1101,2134,https://pbs.twimg.com/media/CWeKTZTWsAA5R3Z.jpg,1,,
1518,677644091929329666,2015-12-18 00:18:36,Twitter for iPhone,This is a dog swinging. I really enjoyed it so I hope you all do as well. 11/10 https://t.co/Ozo9KHTRND,11,10,unknown,,886,2040,https://pbs.twimg.com/ext_tw_video_thumb/677644010865999872/pu/img/zVHEMYnJKzq1SauT.jpg,1,62,chihuahua
1519,677573743309385728,2015-12-17 19:39:03,Twitter for iPhone,This is Sandy. He's sexually confused. Thinks he's a pigeon. Also an All-American cheese catcher. 10/10 so petable https://t.co/Htu8plSqEu,10,10,sandy,,819,2322,https://pbs.twimg.com/media/CWc5uVPXIAErLYr.jpg,2,,
1520,677565715327688705,2015-12-17 19:07:09,Twitter for iPhone,Contortionist pup here. Inside pentagram. Clearly worships Satan. Known to slowly push fragile stuff off tables 6/10 https://t.co/EX9oR55VMe,6,10,unknown,,513,1409,https://pbs.twimg.com/media/CWcybBmWcAAigAQ.jpg,1,39,basset
1521,677557565589463040,2015-12-17 18:34:46,Twitter for iPhone,Reckless pupper here. Not even looking at road. Absolute menace. No regard for fellow pupper lives. 10/10 still cute https://t.co/96IBkOYB7j,10,10,unknown,pupper,1322,2665,https://pbs.twimg.com/media/CWcrAVQWEAA6QMp.jpg,1,24,shih-tzu
1522,677547928504967168,2015-12-17 17:56:29,Twitter for iPhone,Not much to say here. I just think everyone needs to see this. 12/10 https://t.co/AGag0hFHpe,12,10,unknown,,4076,7568,https://pbs.twimg.com/media/CWciPonWEAUOqLD.jpg,1,91,american_staffordshire_terrier
1523,677530072887205888,2015-12-17 16:45:31,Twitter for iPhone,Say hello to Axel. He's a Black Chevy Pinot on wheels. 0 to 60 in 5.7 seconds (if downhill). 9/10 I call shotgun https://t.co/DKe9DBnnHE,9,10,axel,,250,1161,https://pbs.twimg.com/media/CWcSAI-WUAAOB9W.jpg,1,68,staffordshire_bullterrier
1524,677334615166730240,2015-12-17 03:48:51,Twitter for iPhone,This dog gave up mid jump. 9/10 https://t.co/KmMv3Y2zI8,9,10,unknown,,328,1477,https://pbs.twimg.com/media/CWZgPPUWUAAUOvu.jpg,2,85,lakeland_terrier
1525,677331501395156992,2015-12-17 03:36:28,Twitter for iPhone,Meet Humphrey. He's a Northern Polyp Viagra. One ear works. Face stuck like that. Always surprised. 9/10 petable af https://t.co/FS7eJQM2F4,9,10,humphrey,,265,1189,https://pbs.twimg.com/media/CWZdaGxXAAAjGjb.jpg,1,31,beagle
1526,677328882937298944,2015-12-17 03:26:04,Twitter for iPhone,This is Derek. All the dogs adore Derek. He's a great guy. 10/10 really solid pup https://t.co/KgcsGNb61s,10,10,derek,,1693,3938,https://pbs.twimg.com/media/CWZbBlAUsAAjRg5.jpg,1,2,kelpie
1527,677314812125323265,2015-12-17 02:30:09,Twitter for iPhone,"Meet Tassy &amp; Bee. Tassy is pretty chill, but Bee is convinced the Ruffles are haunted. 10/10 &amp; 11/10 respectively https://t.co/fgORpmTN9C",10,10,tassy,,611,1799,https://pbs.twimg.com/media/CWZOOIUW4AAQrX_.jpg,2,92,blenheim_spaniel
1528,677301033169788928,2015-12-17 01:35:24,Twitter for iPhone,This is Juckson. He's totally on his way to a nascar race. 5/10 for Juckson https://t.co/IoLRvF0Kak,5,10,juckson,,471,1362,https://pbs.twimg.com/media/CWZBsjPWsAAZFFl.jpg,1,66,japanese_spaniel
1529,677269281705472000,2015-12-16 23:29:14,Twitter for iPhone,This is the happiest pupper I've ever seen. 10/10 would trade lives with https://t.co/ep8ATEJwRb,10,10,the,pupper,790,2164,https://pbs.twimg.com/media/CWYk0WxWoAAEwRt.jpg,1,65,shetland_sheepdog
1530,677228873407442944,2015-12-16 20:48:40,Twitter for iPhone,Say hello to Chuq. He just wants to fit in. 11/10 https://t.co/hGkMCjZzn4,11,10,chuq,,1840,3837,https://pbs.twimg.com/media/CWYAEINW4AIuw8P.jpg,1,,
1531,677187300187611136,2015-12-16 18:03:28,Twitter for iPhone,Here we see a Byzantine Rigatoni. Very aerodynamic. No eyes. Actually not windy here they just look like that. 9/10 https://t.co/gzI0m6wXRo,9,10,unknown,,1033,2981,https://pbs.twimg.com/media/CWXaQMBWcAAATDi.jpg,1,28,english_setter
1532,676975532580409345,2015-12-16 04:01:59,Twitter for iPhone,This is Cooper. He doesn't know how cheese works. Likes the way it feels on his face. Cheeky tongue slip. 11/10 https://t.co/j1zczS0lI5,11,10,cooper,,1203,3015,https://pbs.twimg.com/media/CWUZpydWcAAeipD.jpg,1,36,malamute
1533,676957860086095872,2015-12-16 02:51:45,Twitter for iPhone,10/10 I'd follow this dog into battle no questions asked https://t.co/ngTNXYQF0L,10,10,unknown,,907,2395,https://pbs.twimg.com/ext_tw_video_thumb/676957802976419840/pu/img/dCj-qlXo73A5hf6Q.jpg,1,77,labrador_retriever
1534,676949632774234114,2015-12-16 02:19:04,Twitter for iPhone,This is Tyrus. He's a Speckled Centennial Ticonderoga. Terrified of floating red ball. Nifty bandana. 8/10 v petable https://t.co/HqM3YhCaaa,8,10,tyrus,,448,1413,https://pbs.twimg.com/media/CWUCGMtWEAAjXnS.jpg,1,20,welsh_springer_spaniel
1535,676948236477857792,2015-12-16 02:13:31,Twitter for iPhone,This is Karl. Karl thinks he's slick. 6/10 sneaky pup https://t.co/Lo4ALwjVh4,6,10,karl,,980,2354,https://pbs.twimg.com/media/CWUA1GFW4AAowiq.jpg,1,,
1536,676946864479084545,2015-12-16 02:08:04,Twitter for iPhone,This pups goal was to get all four feet as close to each other as possible. Valiant effort 12/10 https://t.co/2mXALbgBTV,12,10,unknown,,426,1844,https://pbs.twimg.com/media/CWT_lOQWUAAXPaY.jpg,1,75,pekinese
1537,676942428000112642,2015-12-16 01:50:26,Twitter for iPhone,Who leaves the last cupcake just sitting there? 9/10 https://t.co/PWMqAoEx2a,9,10,unknown,,855,2261,https://pbs.twimg.com/media/CWT7imQXIAMwpQ2.jpg,1,,
1538,676936541936185344,2015-12-16 01:27:03,Twitter for iPhone,Here we see a rare pouched pupper. Ample storage space. Looks alert. Jumps at random. Kicked open that door. 8/10 https://t.co/mqvaxleHRz,8,10,unknown,pupper,5515,13809,https://pbs.twimg.com/media/CWT2MUgWIAECWig.jpg,1,54,chesapeake_bay_retriever
1539,676897532954456065,2015-12-15 22:52:02,Twitter for iPhone,Exotic handheld dog here. Appears unathletic. Feet look deadly. Can be thrown a great distance. 5/10 might pet idk https://t.co/Avq4awulqk,5,10,unknown,,817,2426,https://pbs.twimg.com/media/CWTSt0UW4AALMNB.jpg,1,,
1540,676864501615042560,2015-12-15 20:40:47,Twitter for iPhone,Meet Ash. He's just a head now. Lost his body during the Third Crusade. Still in good spirits. 10/10 would pet well https://t.co/NJj2uP0atK,10,10,ash,,808,2294,https://pbs.twimg.com/media/CWS0q8iU8AE2Srr.jpg,1,37,chesapeake_bay_retriever
1541,676821958043033607,2015-12-15 17:51:44,Twitter for iPhone,Finally some constructive political change in this country. 11/10 https://t.co/mvQaETHVSb,11,10,unknown,,17605,25124,https://pbs.twimg.com/media/CWSN-vaXAAA8Ehr.jpg,2,86,great_pyrenees
1542,676819651066732545,2015-12-15 17:42:34,Twitter for iPhone,Watch out Airbud. This pupper is also good at the sports. 12/10 I'm thinking D1 https://t.co/1HrFdo7M0C,12,10,unknown,pupper,741,1957,https://pbs.twimg.com/media/CWSL4W8WsAAE4KU.jpg,2,3,labrador_retriever
1543,676811746707918848,2015-12-15 17:11:09,Twitter for iPhone,Say hello to Penny &amp; Gizmo. They are practicing their caroling. The ambition in the room is tangible. 9/10 for both https://t.co/aqBHjjh5VD,9,10,penny,,469,1536,https://pbs.twimg.com/media/CWSEsO9WwAAX-fZ.jpg,1,44,chihuahua
1544,676776431406465024,2015-12-15 14:50:49,Twitter for iPhone,"When someone yells ""cops!"" at a party and you gotta get your drunk friend out of there. 10/10 https://t.co/4rMZi5Ca1k",10,10,unknown,,2249,5405,https://pbs.twimg.com/ext_tw_video_thumb/676776408941662209/pu/img/k-6I3YEZAQtYPBXR.jpg,1,,
1545,676617503762681856,2015-12-15 04:19:18,Twitter for iPhone,I promise this wasn't meant to be a cuteness overload account but ermergerd look at this cozy pupper. 13/10 https://t.co/mpQl2rJjDh,13,10,unknown,pupper,1108,3149,https://pbs.twimg.com/media/CWPUB9TWwAALPPx.jpg,1,84,chihuahua
1546,676613908052996102,2015-12-15 04:05:01,Twitter for iPhone,This is the saddest/sweetest/best picture I've been sent. 12/10 ðŸ˜¢ðŸ¶ https://t.co/vQ2Lw1BLBF,12,10,the,,219,1183,https://pbs.twimg.com/media/CWPQwmJWUAAu_At.jpg,1,9,doberman
1547,676606785097199616,2015-12-15 03:36:42,Twitter for iPhone,*screeches for a sec and then faints* 12/10 https://t.co/N5QL4ySBEx,12,10,unknown,,490,2039,https://pbs.twimg.com/media/CWPKSGpWcAQN6mw.jpg,1,14,malinois
1548,676603393314578432,2015-12-15 03:23:14,Twitter for iPhone,This is Godzilla pupper. He had a ruff childhood &amp; now deflects that pain outward by terrorizing cities. Tragic 9/10 https://t.co/g1tLGkyaxr,9,10,godzilla,pupper,440,1280,https://pbs.twimg.com/media/CWPHMqKVAAAE78E.jpg,1,87,whippet
1549,676588346097852417,2015-12-15 02:23:26,Twitter for iPhone,This is Bubbles. He kinda resembles a fish. Always makes eye contact with u no matter what. Sneaky tongue slip. 5/10 https://t.co/Nrhvc5tLFT,5,10,bubbles,,896,2533,https://pbs.twimg.com/media/CWO5gmCUYAAX4WA.jpg,1,97,boston_bull
1550,676582956622721024,2015-12-15 02:02:01,Twitter for iPhone,"Meet Vinnie. He's having fun while being safe. Well not a lot of fun, but definitely safe, and that's important 8/10 https://t.co/vZYtynZZlH",8,10,vinnie,,312,1310,https://pbs.twimg.com/media/CWO0m8tUwAAB901.jpg,1,19,boston_bull
1551,676575501977128964,2015-12-15 01:32:24,Twitter for iPhone,This pupper is very passionate about Christmas. Wanted to give the tree a hug. So cute. 8/10 https://t.co/NsGyECJuq7,8,10,unknown,pupper,1254,2807,https://pbs.twimg.com/media/CWOt07EUsAAnOYW.jpg,1,7,yorkshire_terrier
1552,676533798876651520,2015-12-14 22:46:41,Twitter for iPhone,ITSOFLUFFAYYYYY 12/10 https://t.co/bfw13CnuuZ,12,10,unknown,,621,2025,https://pbs.twimg.com/media/CWOH4s9U8AEtkmQ.jpg,1,26,chow
1553,676496375194980353,2015-12-14 20:17:59,Twitter for iPhone,Say hello to Griffin. He's upset because his costume for Halloween didn't arrive until today. 9/10 cheer up pup https://t.co/eoBCjSFajX,9,10,griffin,,602,1641,https://pbs.twimg.com/media/CWNl3S9WcAARN34.jpg,1,98,pug
1554,676470639084101634,2015-12-14 18:35:43,Twitter for iPhone,Three generations of pupper. 11/10 for all https://t.co/tAmQYvzrau,11,10,unknown,pupper,5224,12616,https://pbs.twimg.com/media/CWNOdIpWoAAWid2.jpg,1,79,golden_retriever
1555,676440007570247681,2015-12-14 16:34:00,Twitter for iPhone,Hope your Monday isn't too awful. Here's two baseball puppers. 11/10 for each https://t.co/dB0H9hdZai,11,10,unknown,pupper,748,1863,https://pbs.twimg.com/media/CWMyl9EWUAAnZJ0.jpg,2,57,maltese_dog
1556,676430933382295552,2015-12-14 15:57:56,Twitter for iPhone,"Meet Duke. He's an Urban Parmesan. They know he's scared of the green rubber dog. ""Why u do dis?"" thinks Duke. 10/10 https://t.co/3bim9U5Idr",10,10,duke,,385,1526,https://pbs.twimg.com/media/CWMqV7WUYAEEClG.jpg,1,58,golden_retriever
1557,676263575653122048,2015-12-14 04:52:55,Twitter for iPhone,All this pupper wanted to do was go skiing. No one told him about the El NiÃ±o. Poor pupper. 10/10 maybe next year https://t.co/fTgbq1UBR9,10,10,unknown,pupper,609,2243,https://pbs.twimg.com/media/CWKSIfUUYAAiOBO.jpg,1,9,toy_poodle
1558,676237365392908289,2015-12-14 03:08:46,Twitter for iPhone,Say hello to Winston. He has no respect for the system. Much rebellion. I think that's a palm tree... nice. 8/10 https://t.co/dOLQddhXLZ,8,10,winston,,331,1335,https://pbs.twimg.com/media/CWJ6Sc-WwAAlpI6.jpg,1,96,french_bulldog
1559,676219687039057920,2015-12-14 01:58:31,Twitter for iPhone,This is Kenneth. He's stuck in a bubble. 10/10 hang in there Kenneth https://t.co/uQt37xlYMJ,10,10,kenneth,,31989,67100,https://pbs.twimg.com/media/CWJqN9iWwAAg86R.jpg,1,0,whippet
1560,676215927814406144,2015-12-14 01:43:35,Twitter for iPhone,This is Herm. He just wants to be like the other dogs. Sneaky tongue slip. Super fuzzy. 9/10 would cuddle firmly https://t.co/tg8h9lzCHv,9,10,herm,,661,1881,https://pbs.twimg.com/media/CWJmzNsWUAE706Z.jpg,1,,
1561,676191832485810177,2015-12-14 00:07:50,Twitter for iPhone,These two pups just met and have instantly bonded. Spectacular scene. Mesmerizing af. 10/10 and 7/10 for blue dog https://t.co/gwryaJO4tC,10,10,unknown,,1145,2478,https://pbs.twimg.com/media/CWJQ4UmWoAIJ29t.jpg,2,37,chihuahua
1562,676146341966438401,2015-12-13 21:07:04,Twitter for iPhone,This is Bert. He likes flowers. 10/10 https://t.co/lmQRrNxaQu,10,10,bert,,744,2077,https://pbs.twimg.com/media/CWIngp5WEAAJOy3.jpg,1,38,irish_water_spaniel
1563,676101918813499392,2015-12-13 18:10:33,Twitter for iPhone,Meet Striker. He's ready for Christmas. 11/10 https://t.co/B3xxSLjQSH,11,10,striker,,1284,3042,https://pbs.twimg.com/media/CWH_FTgWIAAwOUy.jpg,1,22,shih-tzu
1564,676098748976615425,2015-12-13 17:57:57,Twitter for iPhone,Extremely rare pup here. Very religious. Always praying. Too many legs. Not overwhelmingly fluffy. Won't bark. 3/10 https://t.co/REyE5YKVBb,3,10,unknown,,1623,3279,https://pbs.twimg.com/media/CWH8L72UkAAvjql.jpg,1,,
1565,676089483918516224,2015-12-13 17:21:08,Twitter for iPhone,"""Yes hello I'ma just snag this here toasted bagel real quick. carry on."" 9/10 https://t.co/Cuz0Osnekp",9,10,unknown,,483,1431,https://pbs.twimg.com/media/CWHzzFGXIAA0Y_H.jpg,1,74,bull_mastiff
